{
  "componentName": "neopixel_strip",
  "displayName": "NeoPixel RGB LED Strip",
  "vendor": "Adafruit",
  "type": "neopixel",
  "productURL": "https://www.adafruit.com/product/1138",
  "documentationURL": "https://learn.adafruit.com/adafruit-neopixel-uberguide",

  "driver": {
    "package": "neopixel",
    "repo": "https://github.com/adafruit/Adafruit_CircuitPython_NeoPixel",
    "importName": "neopixel",
    "example": "import board, neopixel\npixels = neopixel.NeoPixel(board.NEOPIXEL, 10, brightness=0.2)\npixels[0] = (255, 0, 0)\npixels.show()"
  },

  "sensors": [],

  "visual": {
    "icon": "led_strip",
    "color": "#9b59b6",
    "widget": "led_strip"
  }
}
