{
  "componentName": "mpl115a2",
  "displayName": "MPL115A2",
  "vendor": "Freescale Semiconductor",
  "type": "i2c",
  "productURL": "https://www.adafruit.com/product/992",
  "documentationURL": "https://cdn-shop.adafruit.com/datasheets/MPL115A2.pdf",
  "driver": {
    "package": "adafruit_mpl115a2",
    "repo": "https://github.com/adafruit/adafruit_circuitpython_mpl115a2",
    "importName": "adafruit_mpl115a2"
  },
  "i2c": {
    "addresses": [
      96
    ],
    "defaultAddress": 96,
    "registers": []
  },
  "sensors": [
    {
      "type": "ambient-temp",
      "displayName": "Temperature Sensor (\u00b0C)",
      "unit": "\u00b0C",
      "range": {
        "min": -40,
        "max": 85
      },
      "defaultValue": 22,
      "defaultPeriod": 0.9
    },
    {
      "type": "ambient-temp-fahrenheit",
      "displayName": "Temperature Sensor (\u00b0F)",
      "unit": "\u00b0F",
      "range": {
        "min": -40,
        "max": 185
      },
      "defaultValue": 72,
      "defaultPeriod": 0.9
    },
    {
      "type": "pressure",
      "displayName": "Pressure Sensor",
      "unit": "hPa",
      "range": {
        "min": 300,
        "max": 1100
      },
      "defaultValue": 1013.25,
      "defaultPeriod": 0.9
    }
  ],
  "visual": {
    "icon": "thermometer",
    "color": "#e74c3c",
    "widget": "slider"
  }
}
