{
  "componentName": "scd40",
  "displayName": "SCD40/SCD41",
  "vendor": "Sensirion",
  "type": "i2c",
  "productURL": "https://www.adafruit.com/product/5187",
  "documentationURL": "https://learn.adafruit.com/adafruit-scd-40-and-scd-41",
  "i2c": {
    "addresses": [
      98
    ],
    "defaultAddress": 98,
    "registers": []
  },
  "sensors": [
    {
      "type": "ambient-temp",
      "displayName": "Temperature Sensor (\u00b0C)",
      "unit": "\u00b0C",
      "range": {
        "min": -40,
        "max": 85
      },
      "defaultValue": 22,
      "defaultPeriod": 0.9
    },
    {
      "type": "ambient-temp-fahrenheit",
      "displayName": "Temperature Sensor (\u00b0F)",
      "unit": "\u00b0F",
      "range": {
        "min": -40,
        "max": 185
      },
      "defaultValue": 72,
      "defaultPeriod": 0.9
    },
    {
      "type": "humidity",
      "displayName": "Humidity Sensor",
      "unit": "%RH",
      "range": {
        "min": 0,
        "max": 100
      },
      "defaultValue": 45,
      "defaultPeriod": 0.9
    },
    {
      "type": "co2",
      "displayName": "CO2",
      "unit": "ppm",
      "range": {
        "min": 400,
        "max": 8192
      },
      "defaultValue": 400,
      "defaultPeriod": 0.9
    }
  ],
  "visual": {
    "icon": "thermometer",
    "color": "#e74c3c",
    "widget": "slider"
  }
}
