{
  "componentName": "dps310",
  "displayName": "DPS310",
  "vendor": "Infineon",
  "type": "i2c",
  "productURL": "https://www.adafruit.com/product/4494",
  "documentationURL": "https://learn.adafruit.com/adafruit-dps310-precision-barometric-pressure-sensor",
  "driver": {
    "package": "adafruit_dps310",
    "repo": "https://github.com/adafruit/adafruit_circuitpython_dps310",
    "importName": "adafruit_dps310"
  },
  "i2c": {
    "addresses": [
      119,
      118
    ],
    "defaultAddress": 119,
    "registers": []
  },
  "sensors": [
    {
      "type": "ambient-temp",
      "displayName": "Temperature Sensor (\u00b0C)",
      "unit": "\u00b0C",
      "range": {
        "min": -40,
        "max": 85
      },
      "defaultValue": 22,
      "defaultPeriod": 0.9
    },
    {
      "type": "ambient-temp-fahrenheit",
      "displayName": "Temperature Sensor (\u00b0F)",
      "unit": "\u00b0F",
      "range": {
        "min": -40,
        "max": 185
      },
      "defaultValue": 72,
      "defaultPeriod": 0.9
    },
    {
      "type": "pressure",
      "displayName": "Pressure Sensor",
      "unit": "hPa",
      "range": {
        "min": 300,
        "max": 1100
      },
      "defaultValue": 1013.25,
      "defaultPeriod": 0.9
    }
  ],
  "visual": {
    "icon": "thermometer",
    "color": "#e74c3c",
    "widget": "slider"
  }
}
