{
  "componentName": "7seg",
  "displayName": "7-Segment LED Matrix",
  "vendor": "Adafruit",
  "type": "i2c",
  "productURL": "https://www.adafruit.com/product/878",
  "documentationURL": "https://learn.adafruit.com/adafruit-led-backpack/0-dot-56-seven-segment-backpack",
  "i2c": {
    "addresses": [
      112,
      113,
      114,
      115,
      116,
      117,
      118,
      119
    ],
    "defaultAddress": 112,
    "registers": []
  },
  "visual": {
    "icon": "chip",
    "color": "#95a5a6",
    "widget": "gauge"
  }
}
