{
  "componentName": "oled64x32default",
  "displayName": "64x32 OLED (Small Font)",
  "vendor": "Generic",
  "type": "i2c",
  "productURL": "https://www.digikey.com/en/products/detail/midas-displays/MDOB064032AV-WI/18088023",
  "documentationURL": "https://mm.digikey.com/Volume0/opasdata/d220001/medias/docus/4808/MDOB064032AV-WI.pdf",
  "i2c": {
    "addresses": [
      61,
      60
    ],
    "defaultAddress": 61,
    "registers": []
  },
  "visual": {
    "icon": "chip",
    "color": "#95a5a6",
    "widget": "gauge"
  }
}
