{
  "componentName": "vl53l4cd",
  "displayName": "VL53L4CD",
  "vendor": "STMicroelectronics",
  "type": "i2c",
  "productURL": "https://www.adafruit.com/product/5396",
  "documentationURL": "https://learn.adafruit.com/adafruit-vl53l4cd-time-of-flight-distance-sensor",
  "driver": {
    "package": "adafruit_vl53l4cd",
    "repo": "https://github.com/adafruit/adafruit_circuitpython_vl53l4cd",
    "importName": "adafruit_vl53l4cd"
  },
  "i2c": {
    "addresses": [
      41
    ],
    "defaultAddress": 41,
    "registers": []
  },
  "sensors": [
    {
      "type": "proximity",
      "displayName": "ToF Sensor",
      "unit": "",
      "range": {
        "min": 0,
        "max": 255
      },
      "defaultValue": 0,
      "defaultPeriod": 0.03
    }
  ],
  "visual": {
    "icon": "radar",
    "color": "#2ecc71",
    "widget": "slider"
  }
}
