{
  "componentName": "sht3x",
  "displayName": "SHT3X",
  "vendor": "Sensirion",
  "type": "i2c",
  "productURL": "https://www.adafruit.com/product/2857",
  "documentationURL": "https://learn.adafruit.com/adafruit-sht31-d-temperature-and-humidity-sensor-breakout/overview",
  "i2c": {
    "addresses": [
      68,
      69
    ],
    "defaultAddress": 68,
    "registers": []
  },
  "sensors": [
    {
      "type": "ambient-temp",
      "displayName": "Temperature Sensor (\u00b0C)",
      "unit": "\u00b0C",
      "range": {
        "min": -40,
        "max": 85
      },
      "defaultValue": 22,
      "defaultPeriod": 0.9
    },
    {
      "type": "ambient-temp-fahrenheit",
      "displayName": "Temperature Sensor (\u00b0F)",
      "unit": "\u00b0F",
      "range": {
        "min": -40,
        "max": 185
      },
      "defaultValue": 72,
      "defaultPeriod": 0.9
    },
    {
      "type": "humidity",
      "displayName": "Humidity Sensor",
      "unit": "%RH",
      "range": {
        "min": 0,
        "max": 100
      },
      "defaultValue": 45,
      "defaultPeriod": 0.9
    }
  ],
  "visual": {
    "icon": "thermometer",
    "color": "#e74c3c",
    "widget": "slider"
  }
}
