{
  "componentName": "mcp9808",
  "displayName": "MCP9808",
  "vendor": "Microchip",
  "type": "i2c",
  "productURL": "https://www.adafruit.com/product/1782",
  "documentationURL": "https://learn.adafruit.com/adafruit-mcp9808-precision-i2c-temperature-sensor-guide/overview",
  "driver": {
    "package": "adafruit_mcp9808",
    "repo": "https://github.com/adafruit/adafruit_circuitpython_mcp9808",
    "importName": "adafruit_mcp9808"
  },
  "i2c": {
    "addresses": [
      24,
      25,
      26,
      27,
      28,
      29,
      30,
      31
    ],
    "defaultAddress": 24,
    "registers": []
  },
  "sensors": [
    {
      "type": "ambient-temp",
      "displayName": "Temperature Sensor (\u00b0C)",
      "unit": "\u00b0C",
      "range": {
        "min": -40,
        "max": 85
      },
      "defaultValue": 22,
      "defaultPeriod": 0.9
    },
    {
      "type": "ambient-temp-fahrenheit",
      "displayName": "Temperature Sensor (\u00b0F)",
      "unit": "\u00b0F",
      "range": {
        "min": -40,
        "max": 185
      },
      "defaultValue": 72,
      "defaultPeriod": 0.9
    }
  ],
  "visual": {
    "icon": "thermometer",
    "color": "#e74c3c",
    "widget": "slider"
  }
}
