{
  "componentName": "vl53l4cx",
  "displayName": "VL53L4CX",
  "vendor": "STMicroelectronics",
  "type": "i2c",
  "productURL": "https://www.adafruit.com/product/5425",
  "documentationURL": "https://learn.adafruit.com/adafruit-vl53l4cx-time-of-flight-distance-sensor",
  "i2c": {
    "addresses": [
      41
    ],
    "defaultAddress": 41,
    "registers": []
  },
  "sensors": [
    {
      "type": "proximity",
      "displayName": "ToF Sensor - Object 1",
      "unit": "",
      "range": {
        "min": 0,
        "max": 255
      },
      "defaultValue": 0,
      "defaultPeriod": 0.03
    },
    {
      "type": "raw",
      "displayName": "ToF Sensor - Object 2",
      "unit": "",
      "range": {
        "min": 0,
        "max": 65535
      },
      "defaultValue": 0,
      "defaultPeriod": 0.03
    }
  ],
  "visual": {
    "icon": "radar",
    "color": "#2ecc71",
    "widget": "slider"
  }
}
